{"$defs":{"CausalDigest":{"pattern":"^[0-9a-f]{64}$","type":"string"},"ContentID":{"pattern":"^[0-9a-f]{64}$","type":"string"},"bounded_utf8_registry_string":{"maxLength":128,"minLength":1,"type":"string"},"bounded_utf8_registry_string_256":{"maxLength":256,"minLength":1,"type":"string"},"i128s":{"pattern":"^(0|-?[1-9][0-9]*)$","type":"string"},"rfc3339_full_date":{"pattern":"^[0-9]{4}-[0-9]{2}-[0-9]{2}$","type":"string"},"rfc3339_ns_utc":{"pattern":"^[0-9]{4}-[0-9]{2}-[0-9]{2}T[0-9]{2}:[0-9]{2}:[0-9]{2}\\.[0-9]{9}Z$","type":"string"},"safe_relative_path":{"pattern":"^(?![A-Za-z]:)(?!/)(?!\\.{1,2}(?:/|$))(?!.*(?:/\\.{1,2})(?:/|$))(?!.*//)[^/\\\\:\\x00]+(?:/[^/\\\\:\\x00]+)*$","type":"string"},"sha256":{"pattern":"^[0-9a-f]{64}$","type":"string"},"sq18s":{"pattern":"^(0|-?[1-9][0-9]*)$","type":"string"},"u64s":{"pattern":"^(0|[1-9][0-9]*)$","type":"string"},"uints":{"pattern":"^(0|[1-9][0-9]*)$","type":"string"},"uq18s":{"pattern":"^(0|[1-9][0-9]*)$","type":"string"}},"$id":"urn:build-finance:contract:feature-snapshot:v1","$schema":"https://json-schema.org/draft/2020-12/schema","additionalProperties":false,"properties":{"as_of_admission_sequence":{"$ref":"#/$defs/u64s"},"as_of_event_id":{"anyOf":[{"$ref":"#/$defs/ContentID"},{"type":"null"}]},"as_of_ingest_sequence":{"$ref":"#/$defs/u64s"},"base_decimals":{"maximum":18,"minimum":0,"type":"integer"},"base_mint":{"$ref":"#/$defs/bounded_utf8_registry_string"},"decision_sequence":{"$ref":"#/$defs/u64s"},"equal_time_group":{"$ref":"#/$defs/u64s"},"event_time":{"anyOf":[{"$ref":"#/$defs/rfc3339_ns_utc"},{"type":"null"}]},"feature_code_sha256":{"$ref":"#/$defs/sha256"},"feature_set_version":{"const":"solana-jupiter-deterministic-features/v1"},"features":{"additionalProperties":false,"properties":{"atr_14_price_q18":{"anyOf":[{"$ref":"#/$defs/sq18s"},{"type":"null"}]},"breakout_high_20_price_q18":{"anyOf":[{"$ref":"#/$defs/sq18s"},{"type":"null"}]},"breakout_low_20_price_q18":{"anyOf":[{"$ref":"#/$defs/sq18s"},{"type":"null"}]},"ema_fast_price_q18":{"anyOf":[{"$ref":"#/$defs/sq18s"},{"type":"null"}]},"ema_slow_price_q18":{"anyOf":[{"$ref":"#/$defs/sq18s"},{"type":"null"}]},"history_count":{"maximum":4294967295,"minimum":0,"type":"integer"},"liquidity_quote_atoms":{"anyOf":[{"$ref":"#/$defs/u64s"},{"type":"null"}]},"mid_price_q18":{"anyOf":[{"$ref":"#/$defs/sq18s"},{"type":"null"}]},"return_1_q18":{"anyOf":[{"$ref":"#/$defs/sq18s"},{"type":"null"}]},"route_impact_bps":{"anyOf":[{"maximum":1000000,"minimum":0,"type":"integer"},{"type":"null"}]},"rsi_14_q18":{"anyOf":[{"$ref":"#/$defs/sq18s"},{"type":"null"}]},"stale_age_ns":{"anyOf":[{"$ref":"#/$defs/u64s"},{"type":"null"}]},"volume_20_base_atoms":{"anyOf":[{"$ref":"#/$defs/u64s"},{"type":"null"}]}},"required":["mid_price_q18","return_1_q18","ema_fast_price_q18","ema_slow_price_q18","rsi_14_q18","atr_14_price_q18","breakout_high_20_price_q18","breakout_low_20_price_q18","volume_20_base_atoms","liquidity_quote_atoms","stale_age_ns","route_impact_bps","history_count"],"type":"object"},"ingested_at":{"anyOf":[{"$ref":"#/$defs/rfc3339_ns_utc"},{"type":"null"}]},"input_merkle_root_sha256":{"anyOf":[{"$ref":"#/$defs/sha256"},{"type":"null"}]},"market_id":{"$ref":"#/$defs/bounded_utf8_registry_string"},"missing_features":{"items":{"enum":["atr_14_price_q18","breakout_high_20_price_q18","breakout_low_20_price_q18","ema_fast_price_q18","ema_slow_price_q18","liquidity_quote_atoms","mid_price_q18","return_1_q18","route_impact_bps","rsi_14_q18","stale_age_ns","volume_20_base_atoms"]},"maxItems":12,"type":"array","uniqueItems":true},"observed_at":{"anyOf":[{"$ref":"#/$defs/rfc3339_ns_utc"},{"type":"null"}]},"quote_decimals":{"maximum":18,"minimum":0,"type":"integer"},"quote_mint":{"$ref":"#/$defs/bounded_utf8_registry_string"},"replay_clock_ns":{"$ref":"#/$defs/u64s"},"schema":{"const":"trading.feature-snapshot/v1"},"snapshot_id":{"$ref":"#/$defs/ContentID"}},"required":["schema","snapshot_id","feature_set_version","feature_code_sha256","input_merkle_root_sha256","market_id","base_mint","quote_mint","base_decimals","quote_decimals","decision_sequence","as_of_event_id","as_of_admission_sequence","as_of_ingest_sequence","equal_time_group","replay_clock_ns","event_time","observed_at","ingested_at","features","missing_features"],"type":"object","x-contract-schema":"trading.feature-snapshot/v1"}
