{
  "schema": "trading.feature-snapshot/v1",
  "snapshot_id": "338c961a3031ed7884f23848e34515510683a9646cf07a28f185cde613b49b39",
  "feature_set_version": "solana-jupiter-deterministic-features/v1",
  "feature_code_sha256": "6666666666666666666666666666666666666666666666666666666666666666",
  "input_merkle_root_sha256": "903bde8aa5d8f10e28881c03aa9debcaade274ff407d42088f246b5963695805",
  "market_id": "fixture-base-mint/fixture-quote-mint:jupiter",
  "base_mint": "fixture-base-mint",
  "quote_mint": "fixture-quote-mint",
  "base_decimals": 9,
  "quote_decimals": 6,
  "decision_sequence": "1",
  "as_of_event_id": "d2dd6182525cc6a1c10c2a8d21a69e1ac81464547fcefa16bfad46fce43a5d2b",
  "as_of_admission_sequence": "2",
  "as_of_ingest_sequence": "1",
  "equal_time_group": "1",
  "replay_clock_ns": "0",
  "event_time": "2026-01-01T00:00:00.000000000Z",
  "observed_at": "2026-01-02T00:00:00.000000000Z",
  "ingested_at": "2026-01-02T00:00:00.000000001Z",
  "features": {
    "mid_price_q18": "1000000000000000000",
    "return_1_q18": "0",
    "ema_fast_price_q18": "1010000000000000000",
    "ema_slow_price_q18": "990000000000000000",
    "rsi_14_q18": "50000000000000000000",
    "atr_14_price_q18": "10000000000000000",
    "breakout_high_20_price_q18": "1100000000000000000",
    "breakout_low_20_price_q18": "900000000000000000",
    "volume_20_base_atoms": "10000000000",
    "liquidity_quote_atoms": "10000000",
    "stale_age_ns": "0",
    "route_impact_bps": 25,
    "history_count": 21
  },
  "missing_features": []
}
